{
  "name": "Gerri's BGT NPC Portraits",
  "version": "3.1",
  "links": {
    "homepage": "https://www.baldurs-gate.de/index.php?threads/gerris-nsc-portraits.44541/"
  },
  "files": [
    {
      "filename": "BGT NSC Portraits 3.1.rar",
      "size": 17118189,
      "sha256": "ad358ecfa895ab92faf89ef8302a2b9d86525b06c74f540873f25a989da720f9",
      "download": "https://github.com/gboeck/NSC-Portraits/raw/master/BGT%20NSC%20Portraits%203.1.rar"
    }
  ],
  "games": ["bgt", "eet"],
  "categories": ["portrait"],
  "components": {
    "0": {"type": "std"},
    "1": {"type": "std"},
    "10": {"type": "std"},
    "20": {"type": "std"},
    "21": {"type": "std"},
    "30": {"type": "std"},
    "50": {"type": "std"},
    "300": {"type": "std"},
    "305": {"type": "std"},
    "310": {"type": "std"},
    "1000": {"type": "std"},
    "1001": {"type": "std"},
    "1030": {"type": "std"},
    "1031": {"type": "std"},
    "1050": {"type": "std"},
    "1051": {"type": "std"},
    "1300": {"type": "std"},
    "1310": {"type": "std"},
    "1320": {"type": "std"},
    "1330": {"type": "std"},
    "1340": {"type": "std"},
    "1350": {"type": "std"},
    "1360": {"type": "std"},
    "1370": {"type": "std"},
    "1380": {"type": "std"},
    "1390": {"type": "std"},
    "1400": {"type": "std"},
    "1410": {"type": "std"},
    "1420": {"type": "std"},
    "1430": {"type": "std"},
    "1440": {"type": "std"},
    "1450": {"type": "std"},
    "1470": {"type": "std"},
    "1480": {"type": "std"},
    "1490": {"type": "std"},
    "1500": {"type": "std"},
    "1510": {"type": "std"},
    "1520": {"type": "std"},
    "1530": {"type": "std"},
    "1540": {"type": "std"},
    "1550": {"type": "std"},
    "1580": {"type": "std"},
    "1590": {"type": "std"},
    "1600": {"type": "std"},
    "1610": {"type": "std"},
    "1780": {"type": "std"},
    "2000": {"type": "std"},
    "2010": {"type": "std"},
    "2020": {"type": "std"},
    "3000": {"type": "std"},
    "3010": {"type": "std"},
    "5000": {"type": "std"},
    "5010": {"type": "std"}
  },
  "languages": {
    "en_US": 0,
    "all": 0
  },
  "translations": {
    "en_US": {
      "description": "This mod inserts missing portraits to all non-player characters (NPC) which have to do something directly with quests, avoids the double portraits for different characters, however, leaves existing portraits of NPC-Mods unchanged. Pictures of celebrities and sign styles which do not fit to the world of Baldur were avoided. Particular attention was given to to the character portrayals on the fact that they also fit to the respective characters. Bad characters mostly have also bad expressions, while good characters are to be recognized unambiguously. No images received normal passers-by or other avatars who are only for decoration, have nothing to do with quests, or have otherwise nothing important to say.",
      "components": {
        "0": "Portraits for BG1 (BGT or EET)",
        "1": "Portraits for BG2 and ToB",
        "10": "Portraits for Dark Side of the Sword Coast",
        "20": "Portraits for Northern Tales of the Sword Coast",
        "21": "Alternate Portrait for Will Scarlet of NTotSC",
        "30": "Portraits for Secret of Bone Hill",
        "50": "Portraits for Stone of Askavar",
        "300": "Portraits for BG1 Mini-Quests and Encounters",
        "305": "Portraits for Lure of the Sirines Call",
        "310": "Portraits for Grey Clan Episode I",
        "1000": "Portraits for The Darkest Day",
        "1001": "Alternate NPC-Portraits for The Darkest Day",
        "1030": "Portraits for Region of Terror",
        "1031": "Alternate NPC-Portraits for Region of Terror",
        "1050": "Portraits for Tortured Souls (TS-BP)",
        "1051": "Alternate NPC-Portraits for Tortured Souls (TS-BP)",
        "1300": "Portraits for Tower of Deception",
        "1310": "Portraits for Assassinations",
        "1320": "Portraits for Dungeon Crawl",
        "1330": "Portraits for BG2 Romantic Encounters",
        "1340": "Portraits for Big Picture",
        "1350": "Portraits for Tales of Anegh",
        "1360": "Portraits for Tales of the Deep Gardens",
        "1370": "Portraits for Dark Horizons",
        "1380": "Portraits for Ascalon's Questpack",
        "1390": "Portraits for Jan's Quest",
        "1400": "Portraits for Planar Sphere",
        "1410": "Portraits for Innershade",
        "1420": "Portraits for Fishing for Trouble",
        "1430": "Portraits for Eilistraee's Song",
        "1440": "Portraits for Expanded Thief Stronghold",
        "1450": "Portraits for Gavin BG1",
        "1470": "Portraits for Return to Brynnlaw",
        "1480": "Portraits for Sellswords",
        "1490": "Portraits for Isra BG2",
        "1500": "Portraits for Longer Road",
        "1510": "Portraits for Zalnoya",
        "1520": "Portraits for Ding0's Questpack",
        "1530": "Portraits for Slandor (The Minotaur and Lilacor)",
        "1540": "Portraits for Sirines",
        "1550": "Portraits for Afaaq (Djinni Companion)",
        "1580": "Portraits for Ajoc Mod",
        "1590": "Portraits for ISNF (I Shall Never Forget)",
        "1600": "Portraits for Sandrah",
        "1610": "Portraits for Alternatives",
        "1780": "Portraits for BG1 Romantic Encounters",
        "2000": "Portraits for Ascalon's Breagar",
        "2010": "Portraits for Amber NPC",
        "2020": "Portraits for Grey NPC",
        "3000": "Alternate Portrait for Goo NPC",
        "3010": "Alternate Portrait for Kim NPC",
        "5000": "Alternate Female Character-Creation Portraits",
        "5010": "Alternate Male Character-Creation Potraits"
      }
    }
  },
  "tp2": "NSCPortraits",
  "safe": 2,
  "authors": ["Gerri"]
}
