{
  "name": "Follower_It",
  "version": "6.3",
  "links": {
    "homepage": "https://www.baldursgateworld.fr/viewtopic.php?p=518215"
  },
  "files": [
    {
      "filename": "lin-Derats_Follower_it-v6.3.zip",
      "size": 1902582,
      "sha256": "981f87f6f78d4e67854d99929107b6a052e6baf3ea447332c5426d7acb700103",
      "download": "https://github.com/Deratiseur/Follower_It/releases/download/v6.3/lin-Derats_Follower_it-v6.3.zip",
      "platforms": ["linux"]
    },
    {
      "filename": "mac-Derats_Follower_it-v6.3.zip",
      "size": 2130122,
      "sha256": "73e88580cbac91faf4f0755aad6ef208f6ca7cefc174c027a9d00fdb087ad352",
      "download": "https://github.com/Deratiseur/Follower_It/releases/download/v6.3/mac-Derats_Follower_it-v6.3.zip",
      "platforms": ["macos"]
    },
    {
      "filename": "win-Derats_Follower_it-v6.3.zip",
      "size": 2074923,
      "sha256": "0b2f76eca606cc16c6117dcdc5d775ba3aa943bc4e72acd599a60d3ed69d2268",
      "download": "https://github.com/Deratiseur/Follower_It/releases/download/v6.3/win-Derats_Follower_it-v6.3.zip",
      "platforms": ["windows"]
    }
  ],
  "games": ["bg2", "bg2ee", "bgee", "bgt", "eet", "iwdee", "sod"],
  "categories": ["gameplay"],
  "components": {
    "0": {"type": "std", "category": "npcx"},
    "choice_0": {"type": "muc", "components": ["1", "2", "3", "4"], "category": "npcx", "default": "1", "games": ["bg2ee", "eet", "iwdee"]}
  },
  "languages": {
    "fr_FR": 0,
    "en_US": 1
  },
  "translations": {
    "fr_FR": {
      "description": "Ce mod permet de transformer n'importe quel compagnon en suiveur (qui ne compte pas la limite de groupe). Il perd toute possibilité de dialogues, discutions, quête. Plusieurs options permettent de rendre les suiveurs immortels, pour que vous n'ayez pas à gérer leur résurrection et le lot d'inconvénients qui vont avec.",
      "components": {
        "0": "Transformez les compagnons en familier",
        "choice_0": "Les suiveurs sont invulnerables (cheat)",
        "1": "Fausse mort pendant 1 tour, pierre tombale",
        "2": "Fausse mort pendant 1 tour, corps agonisant",
        "3": "Fausse mort indefiniment, baguette pour les relever, pierre tombale",
        "4": "Fausse mort indefiniment, baguette pour les relever, corps agonisant"
      }
    },
    "en_US": {
      "description": "This mod lets you turn any companion into a follower (who doesn't count against the party limit). He loses all possibility of banters, discussion or quest. Several options make followers immortal, so you don't have to deal with their resurrection and all the inconvenience that goes with it.",
      "components": {
        "0": "Transform companions into followers",
        "choice_0": "Followers are invulnerable (cheat)",
        "1": "False death for 1 turn, tombstone",
        "2": "False dead for 1 turn, agonizing corpse",
        "3": "Fake dead indefinitely, wand to raise them, tombstone",
        "4": "Fake dead indefinitely, wand to raise them, agonizing corpse"
      }
    },
    "zh_CN": {
      "description": "此模组可将任何同伴转变为追随者（不计入队伍人数上限）。他将失去所有对话、交谈和任务的能力。提供多种选项可使追随者不朽，这样您就不必处理他们的复活及其附带的一系列麻烦。"
    }
  },
  "tp2": "derats_follower_it",
  "safe": 2,
  "authors": ["Deratiseur"]
}
