{
  "name": "Drizzt Saga",
  "version": "3.00",
  "links": {
    "homepage": "http://www.blackwyrmlair.net/Mods/drizztsaga.php"
  },
  "files": [
    {
      "filename": "Drizzt-Saga-master.zip",
      "size": 75883991,
      "sha256": "a8825cca678c9de0f10e313fd119e58df0aef0a3b42b089fd3a8016f66264feb",
      "download": "https://github.com/Black-Wyrm-Lair/Drizzt-Saga/archive/refs/heads/master.zip"
    }
  ],
  "games": ["bg", "bgee", "bgt", "eet", "sod", "tutu"],
  "categories": ["quest"],
  "components": {
    "choice_0": {"type": "muc", "components": ["0", "1"], "default": "0", "games": ["bgee", "bgt", "eet", "sod"]},
    "3": {"type": "std"},
    "4": {"type": "std"},
    "5": {"type": "std"},
    "6": {"type": "std"},
    "1000": {"type": "std", "games": ["bgt"]}
  },
  "languages": {
    "en_US": 0,
    "fr_FR": 1,
    "it_IT": 2,
    "pl_PL": 3,
    "ru_RU": 4,
    "es_ES": 5,
    "zh_CN": 6
  },
  "translations": {
    "fr_FR": {
      "description": "Drizzt est sur le chemin du retour depuis la Côte des Épées en direction du Val de Bise. Ce qu'il ne sait pas, c'est que des temps sombres se profilent sur le Val et ses compagnons l'entraîneront, lui comme vous, dans une aventure aux dimensions épiques.\nCe mod vous propose une quête majeure, aux côtés du célèbre personnage de R.A. Salvatore, qui débute au moment où vous le rencontrez dans le jeu. Cette aventure prend place dans de nouvelles zones inspirées d'Icewind Dale et englobe de nombreuses quêtes secondaires, des monstres inédits, de nouveaux sorts et équipements...\nIl existe deux versions : l'une pour ToSC qui ne comprend pas le français, l'autre pour BG1tutu, BGT et BG:EE, disponible en français.",
      "components": {
        "choice_0": "The Drizzt Saga pour BGEE / Tutu / BGT",
        "0": "Version par defaut : zones connectees par des declencheurs de voyage",
        "1": "Version BP-BGT Worldmap : ajout de toutes les zones a la carte du monde (requiert BP-BGT Worldmap)",
        "3": "Debut repousse : Drizzt revient apres la Tour de Durlag",
        "4": "Empecher d'exploiter les objets des PNJ",
        "5": "Reduire la puissance de certains objets",
        "6": "XP recue pour les creatures reduite au 3/4",
        "1000": "Biffing des ressources"
      }
    },
    "en_US": {
      "description": "Drizzt is on his way back from the Sword Coast to the Vale of Bise. What he doesn't know is that dark times lie ahead in the Valley, and his companions will lead him, and you, on an adventure of epic proportions.\nThis mod features a major quest, alongside the famous character of R.A. Salvatore, which begins the moment you meet him in the game. This adventure takes place in new areas inspired by Icewind Dale, and includes numerous side quests, new monsters, new spells and equipment...\nThere are two versions: one for ToSC, the other for BG1tutu, BGT and BG:EE.",
      "components": {
        "choice_0": "The Drizzt Saga for BGEE/Tutu/BGT",
        "0": "Default version: areas connected by travel triggers",
        "1": "BP-BGT Worldmap version: all areas added to worldmap (requires BP-BGT Worldmap)",
        "3": "Delayed start: Drizzt joins after Durlag's Tower",
        "4": "Fewer NPC's items exploit",
        "5": "Magical Items Nerfing",
        "6": "XP from Creatures lowered by 3/4",
        "1000": "Resource biffing"
      }
    },
    "zh_CN": {
      "description": "崔斯特正从剑湾返回冰风谷。但他不知道的是，黑暗时代正笼罩着冰风谷，他的同伴将把他和你一起卷入一场史诗般的冒险中。\n这个模组为您提供了一个主要任务，与R.A.萨尔瓦托罗的著名角色并肩作战，该任务在您游戏中遇到他时开始。这场冒险发生在受冰风谷启发的新区域中，并包含许多支线任务、新怪物、新法术和装备……\n它有两个版本：一个用于剑湾传奇，但不包含法语；另一个用于博德之门三部曲和博德之门：增强版，提供法语版本。",
      "components": {
        "choice_0": "崔斯特传奇",
        "0": "默认版本：地区以探索方式连接",
        "1": "BP-BGT Worldmap版本：所有地区添加至世界地图（需要BP-BGT Worldmap）",
        "3": "推迟开始时间：崔斯特在杜拉格之塔冒险结束后才入队",
        "4": "更少的NPC物品利用",
        "5": "消弱魔法物品",
        "6": "生物的经验值降低3/4",
        "1000": "资源打包"
      }
    },
    "it_IT": {
      "components": {
        "choice_0": "The Drizzt Saga for BGEE/Tutu/BGT",
        "0": "Default version: areas connected by travel triggers",
        "1": "Installando il Supporto della Worldmap v6",
        "3": "Delayed start: Drizzt joins after Durlag's Tower",
        "4": "Fewer NPC's items exploit",
        "5": "Magical Items Nerfing",
        "6": "XP from Creatures lowered by 3/4",
        "1000": "Resource biffing"
      }
    },
    "pl_PL": {
      "components": {
        "choice_0": "Saga Drizzta dla BG:EE/TuTu/BGT",
        "0": "Obszary polaczone poprzez krawedzie map (domyslnie)",
        "1": "Wszystkie obszary dodane do mapy swiata (wymaga BP-BGT Worldmap)",
        "3": "Opozniony poczatek: Drizzt dolaczy po ukonczeniu Wiezy Durlaga",
        "4": "Usuniecie naduzyc zwiazanych z ekwipunkiem Bohaterow Niezaleznych",
        "5": "Oslabienie magicznych przedmiotow",
        "6": "Obnizenie PD za potwory o 3/4",
        "1000": "Kompresja zasobow"
      }
    },
    "ru_RU": {
      "components": {
        "choice_0": "The Drizzt Saga for BGEE/Tutu/BGT",
        "0": "Default version: areas connected by travel triggers",
        "1": "BP-BGT Worldmap version: all areas added to worldmap (requires BP-BGT Worldmap)",
        "3": "Delayed start: Drizzt joins after Durlag's Tower",
        "4": "Fewer NPC's items exploit",
        "5": "Magical Items Nerfing",
        "6": "XP from Creatures lowered by 3/4",
        "1000": "Resource biffing"
      }
    },
    "es_ES": {
      "components": {
        "choice_0": "La Saga Drizzt para BGEE/Tutu/BGT",
        "0": "Default version: areas connected by travel triggers",
        "1": "Instalando soporte para Worldmap v6",
        "3": "Delayed start: Drizzt joins after Durlag's Tower",
        "4": "Fewer NPC's items exploit",
        "5": "Magical Items Nerfing",
        "6": "XP from Creatures lowered by 3/4",
        "1000": "Resource biffing"
      }
    }
  },
  "tp2": "drizztsaga",
  "safe": 2,
  "authors": ["Flysoup", "Badgert", "pro5", "Erebusant"]
}
